Название вакансии,responsibilities
Арматурщик 4-5 разряд,Опыт работы от 1 года. Наличие удостоверений. Изготовление металлических каркасов для железобетонных конструкций.
Арматурщик,"Монтаж лестничных маршей и площадок, рядовых крупных блоков стен и балконных блоков."
Арматурщик на монолит (Москва),"Что мы хотим от вас: - принимаем бригады. - Опыт работы на монолите. - Готовность к физическому труду. - Пунктуальность. - Желание работать и ЗАРАБАТЫВАТЬ.  Опалубочные работы, армирование, прием и укладка бетона, монтажи многое другое зависит от вашей специальности ."
Арматурщик,"Если нет времени позвонить - пишите на Viber, WhatsApp, Телеграмм. ОТВЕТИМ НА ВСЕ ВОПРОСЫ!"
Арматурщик,"Опыт работы в аналогичной должности от года. Опыт работы в грузовом сегменте будет Вашим преимуществом. Исполнительность и внимательность к деталям. Разборка, сборка грузовых автомобилей и прицепов для проведения кузовных работ."
Арматурщик,Принимаем как с опытом так и без опыта работы. - Высокая работоспособность. - Желание работать и зарабатывать. производство арматурных изделий и конструкций. - чтение чертежей. - работа на арматурных станках.
Арматурщик,"Обязателен аналогичный опыт работы от года. Обязателен опыт замены стекла. Разборка автомобилей для проведения ремонта, сборка отремонтированного автомобиля. Замена стекла."
Арматурщик,"Опыт работы в аналогичной должности от года. Опыт работы в грузовом сегменте будет Вашим преимуществом. Исполнительность и внимательность к деталям. Разборка, сборка грузовых автомобилей и прицепов для проведения кузовных работ."
Бетонщик-арматурщик,Опыт работы. Чтение чертежей приветствуется. Установка опалубки. Вязка арматурного каркаса. Заливка бетона. Уход за бетоном. Снятие опалубки.
Арматурщик,"Понимание работы в бригаде. Дисциплинированность, трудолюбие. Опыт работы в строительстве будет преимуществом. ОБЪЕКТ: РЕКОНСТРУКЦИЯ И СТРОИТЕЛЬСТВО ЖЕЛЕЗНОДОРОЖНЫХ СТАНЦИЙ ГОРОД МОСКВА. Работы на монолите (заливка бетона, укладка и вязка арматуры). Монтажные работы (МК..."
Арматурщик,модули) в шагoвoй доступнocти(новые).
Арматурщик/бетонщик,"Минимальный опыт работы с бетоном, арматурой. Вязка арматуры. Заливка бетона. Заливка котлованов. Возведение стен и перегородок из армированного бетона."
Бетонщик-арматурщик,На строительный объект в г. Северск Томской области требуются рабочие с навыками работы в монолите. Монтаж / демонтаж опалубки. Изготовление и сборка арматурных каркасов. Укладка бетонной смеси.
"Арматурщик на стройку, монолит, Северск","Что мы хотим от вас: - принимаем бригады. - Опыт работы на монолите будет преимуществом, но если опыта нет всему научим . -  С МОСКВЫ ДО СЕВЕРСКА ИДЕТ ОТПРАВКА НА САМОЛЕТЕ ЗА СЧЕТ ОРГАНИЗАЦИИ. - Опалубочные работы, армирование, прием и укладка бетона, монтажи многое..."
"Арматурщик на стройку, Казань",Готовы рассмотреть кандидатов без опыта работы (на площадке имеется обучение по окончанию обучения получаете корочки). Готовность работать вахтовым методом. Ответственность.  
Арматурщик,"Среднее специальное, техническое образование. Опыт работы на малярно-кузовном участке более 1 года. Знание устройства автомобиля. Разборка, сборка а/м под покраску, дефектовка деталей автомобилей, замена стекол."
Арматурщик/Ученик арматурщика,"Знание устройства кузова автомобилей. Опыт работы <highlighttext>арматурщиком</highlighttext> от 3-х лет. Внимательность, добросовестность, аккуратность. Арматурные работы по разборке и сборке автомобилей. Соблюдение техники безопасности и технологии выполнения работ."
"Арматурщик, Сковородино",Опыт работы. Наличие удостоверений. Билеты приобретает организация туда и обратно.
Арматурщик-бетонщик,"Опыт работы с арматурой. Опыт заливки ЖБИ. Изготовление металлокаркасов для ЖБИ. Изготовление металлокаркасов. Заливка каркасов бетоном в формах. Вязание, натяжение арматуры."
Арматурщик,"Среднее специальное, техническое образование. Опыт работы на малярно-кузовном участке более 1 года. Знание устройства автомобиля. Разборка, сборка а/м под покраску, дефектовка деталей автомобилей, замена стекол."
Арматурщик,"Знание конструкции автомобилей. Опыт работы. Аккуратность, ответственность, дисциплинированность. Разборка/сборка элементов автомобиля. Снятие/установка съемных элементов кузова автомобиля. Снятие/вклейка стекол. Шиномонтаж, развал/схождение."
Арматурщик атомобильный,Опыт работы с электрикой приветствуется. Требования: Опыт работы с иномарками. Опыт работы у официального дилера (желательно). Проведение арматурных работ при подготовке автомобилей к жестяным и окрасочным работам. Дефектовочные работы. Разборка/сборка навесных элементов оснащения кузова для...
Арматурщик 5разряд,
Мастер арматурщик,Опыт работы. Желание работать и делать свою работу максимально качественно. Нам важен результат а не процесс. Арматурные работы. Разбор салона. Разбор кузова.
Арматурщик на автосервис,"Опыт работы <highlighttext>арматурщиком</highlighttext> с легковыми автомобилями. Знание и соблюдение стандартов и технологий ремонта. Дефектовка после ДТП. Разборка/сборка а/м для проведения кузовного ремонта. Замена автомобильных стекол, регулировка и подгонка деталей."
Бетонщик арматурщик,Опыт работы. Исполнительность. Ответственность. Укладка бетонной смеси. Разборка опалубки простых конструкций. Подготовка основания при производстве бетонных работ. Монтаж арматурных каркасов. Прогрев бетона в зимнее...
Арматурщик,"Опыт работы <highlighttext>арматурщиком</highlighttext> от 2 лет. Знание и соблюдение стандартов и технологий ремонта. Дефектовка после ДТП. Разборка/сборка а/м для проведения кузовного ремонта. Замена автомобильных стекол, регулировка и подгонка деталей."
Арматурщик,"Опыт работы на строительстве мостов - является преимуществом! Монтаж сложных пространственных каркасов из арматуры, а также арматурно-опалубочных блоков на участке строительства мостов. Монтаж железобетонных, стальных и металлоконструкций."
Арматурщик,Установка опалубки. Вязка арматурного каркаса. Заливка бетона. Уход за бетоном. Снятие опалубки.
"Арматурщик на стройку, Казань","Ответственный подход к выполнению трудовых обязанностей. ОПЫТ РАБОТЫ БУДЕТ ПРЕИМУЩЕСТВОМ, НО ЕСЛИ ОПЫТА НЕТ МЫ ВСЕМУ ОБУЧАЕМ (ПОСЛЕ ОБУЧЕНИЯ ВЫДАЕМ... КОМПЕНСИРУЕМ билет до КАЗАНИ ( сохрани чек ). Оформление и заселение в день визита, со след дня выходите на работу. "
Арматурщик (АВТОРАЗБОР),"Опыт работы <highlighttext>арматурщиком</highlighttext> от 1 года. Внимательность, ответственность, исполнительность. Проведение арматурных работ при подготовке автомобилей к жестяным и окрасочным работам. Дефектовка после ДТП. Разборка/сборка а/м для проведения..."
Арматурщик,модули) в шагoвoй доступнocти(новые).
"Арматурщик на стройку, Казань",Готовы рассмотреть кандидатов без опыта работы (на площадке имеется обучение по окончанию обучения получаете корочки). Готовность работать вахтовым методом. Ответственность.  
Арматурщик-бетонщик,
Арматурщик,"Разборка и сборка деталей. Требования: <highlighttext>Арматурщик</highlighttext> должен знать: —предъявляемые к качеству выполняемых работ услуг , к рациональной организации труда на рабочем..."
Арматурщик,Материальная поддержка.
